Information for device Honeywell PC42tp-203-FP (VID=0x0C2E PID=0xFE16):

Connection Information:
------------------------------
Device current bus speed: HighSpeed
Device address: 0x0008
Current configuration value: 0x00
Number of open pipes: 0

Device Descriptor:
------------------------------
0x12	bLength
0x01	bDescriptorType
0x0200	bcdUSB
0x00	bDeviceClass      
0x00	bDeviceSubClass   
0x00	bDeviceProtocol   
0x40	bMaxPacketSize0   (64 bytes)
0x0C2E	idVendor
0xFE16	idProduct
0x1025	bcdDevice
0x01	iManufacturer   "Honeywell"
0x02	iProduct   "Honeywell PC42tp-203-FP"
0x03	iSerialNumber   "18250B2ABD"
0x01	bNumConfigurations

Device Qualifier Descriptor:
------------------------------
0x0A	bLength
0x06	bDescriptorType
0x0200	bcdUSB
0x00	bDeviceClass      
0x00	bDeviceSubClass   
0x00	bDeviceProtocol   
0x40	bMaxPacketSize0   (64 bytes)
0x01	bNumConfigurations 
0x00	bReserved 

Configuration Descriptor:
------------------------------
0x09	bLength
0x02	bDescriptorType
0x0020	wTotalLength   (32 bytes)
0x01	bNumInterfaces
0x01	bConfigurationValue
0x04	iConfiguration   "Generic Serial config"
0xC0	bmAttributes   (Self-powered Device)
0x01	bMaxPower      (2 mA)

Interface Descriptor:
------------------------------
0x09	bLength
0x04	bDescriptorType
0x00	bInterfaceNumber
0x00	bAlternateSetting
0x02	bNumEndPoints
0x07	bInterfaceClass      (Printer Device Class)
0x01	bInterfaceSubClass   
0x02	bInterfaceProtocol   
0x00	iInterface

Endpoint Descriptor:
------------------------------
0x07	bLength
0x05	bDescriptorType
0x81	bEndpointAddress  (IN endpoint 1)
0x02	bmAttributes      (Transfer: Bulk / Synch: None / Usage: Data)
0x0200	wMaxPacketSize    (512 bytes)
0x00	bInterval         

Endpoint Descriptor:
------------------------------
0x07	bLength
0x05	bDescriptorType
0x01	bEndpointAddress  (OUT endpoint 1)
0x02	bmAttributes      (Transfer: Bulk / Synch: None / Usage: Data)
0x0200	wMaxPacketSize    (512 bytes)
0x00	bInterval         


------------------------------
Other Speed Configuration Descriptor:
------------------------------
0x09	bLength
0x07	bDescriptorType
0x0020	wTotalLength   (32 bytes)
0x01	bNumInterfaces
0x01	bConfigurationValue
0x04	iConfiguration   "Generic Serial config"
0xC0	bmAttributes   (Self-powered Device)
0x01	bMaxPower      (2 mA)

Interface Descriptor:
------------------------------
0x09	bLength
0x04	bDescriptorType
0x00	bInterfaceNumber
0x00	bAlternateSetting
0x02	bNumEndPoints
0x07	bInterfaceClass      (Printer Device Class)
0x01	bInterfaceSubClass   
0x02	bInterfaceProtocol   
0x00	iInterface

Endpoint Descriptor:
------------------------------
0x07	bLength
0x05	bDescriptorType
0x81	bEndpointAddress  (IN endpoint 1)
0x02	bmAttributes      (Transfer: Bulk / Synch: None / Usage: Data)
0x0040	wMaxPacketSize    (64 bytes)
0x00	bInterval         

Endpoint Descriptor:
------------------------------
0x07	bLength
0x05	bDescriptorType
0x01	bEndpointAddress  (OUT endpoint 1)
0x02	bmAttributes      (Transfer: Bulk / Synch: None / Usage: Data)
0x0040	wMaxPacketSize    (64 bytes)
0x00	bInterval         

Microsoft OS Descriptor is not available. Error code: 0x0000001F

String Descriptor Table
--------------------------------
Index  LANGID  String
0x00   0x0000  0x0409 
0x01   0x0409  "Honeywell"
0x02   0x0409  "Honeywell PC42tp-203-FP"
0x03   0x0409  "18250B2ABD"
0x04   0x0409  "Generic Serial config"

------------------------------

Connection path for device: 
Intel(R) USB 3.0 eXtensible Host Controller
Root Hub
Honeywell PC42tp-203-FP (VID=0x0C2E PID=0xFE16) Port: 8

Running on: Windows 7 with Service Pack 1

Brought to you by TDD v2.12.0, Aug  2 2019, 16:35:05
