Information for device SATO SA408 SEPL  (VID=0x1664 PID=0x120B):

Connection Information:
------------------------------
Device current bus speed: FullSpeed
Device address: 0x0001
Current configuration value: 0x00
Number of open pipes: 0

Device Descriptor:
------------------------------
0x12	bLength
0x01	bDescriptorType
0x0110	bcdUSB
0x00	bDeviceClass      
0x00	bDeviceSubClass   
0x00	bDeviceProtocol   
0x08	bMaxPacketSize0   (8 bytes)
0x1664	idVendor
0x120B	idProduct
0x0100	bcdDevice
0x01	iManufacturer   "SATO "
0x02	iProduct   "SATO SA408 SEPL "
0x03	iSerialNumber   "000000001"
0x01	bNumConfigurations

Configuration Descriptor:
------------------------------
0x09	bLength
0x02	bDescriptorType
0x0020	wTotalLength   (32 bytes)
0x01	bNumInterfaces
0x01	bConfigurationValue
0x00	iConfiguration
0xC0	bmAttributes   (Self-powered Device)
0x10	bMaxPower      (32 mA)

Interface Descriptor:
------------------------------
0x09	bLength
0x04	bDescriptorType
0x00	bInterfaceNumber
0x00	bAlternateSetting
0x02	bNumEndPoints
0x07	bInterfaceClass      (Printer Device Class)
0x01	bInterfaceSubClass   
0x02	bInterfaceProtocol   
0x00	iInterface

Endpoint Descriptor:
------------------------------
0x07	bLength
0x05	bDescriptorType
0x01	bEndpointAddress  (OUT endpoint 1)
0x02	bmAttributes      (Transfer: Bulk / Synch: None / Usage: Data)
0x0040	wMaxPacketSize    (64 bytes)
0x00	bInterval         

Endpoint Descriptor:
------------------------------
0x07	bLength
0x05	bDescriptorType
0x82	bEndpointAddress  (IN endpoint 2)
0x02	bmAttributes      (Transfer: Bulk / Synch: None / Usage: Data)
0x0040	wMaxPacketSize    (64 bytes)
0x00	bInterval         

Microsoft OS Descriptor is not available. Error code: 0x000003E3

String Descriptor Table
--------------------------------
Index  LANGID  String
0x00   0x0000  0x0409 
0x01   0x0409  "SATO "
0x02   0x0409  "SATO SA408 SEPL "
0x03   0x0409  "000000001"

------------------------------

Connection path for device: 
Intel(R) 8 Series/C220 Series USB EHCI #2 - 8C2D
Root Hub
Generic USB Hub
SATO SA408 SEPL  (VID=0x1664 PID=0x120B) Port: 6

Running on: Windows 7 with Service Pack 1

Brought to you by TDD v2.12.0, Aug  2 2019, 16:35:05
