Information for device v165w (VID=0x03F0 PID=0x5307):

Connection Information:
------------------------------
Device current bus speed: HighSpeed
Device address: 0x0002
Current configuration value: 0x01
Number of open pipes: 2

Device Descriptor:
------------------------------
0x12	bLength
0x01	bDescriptorType
0x0200	bcdUSB
0x00	bDeviceClass      
0x00	bDeviceSubClass   
0x00	bDeviceProtocol   
0x40	bMaxPacketSize0   (64 bytes)
0x03F0	idVendor
0x5307	idProduct
0x1100	bcdDevice
0x01	iManufacturer   "HP"
0x02	iProduct   "v165w"
0x03	iSerialNumber   "AA00000000006894"
0x01	bNumConfigurations

Device Qualifier Descriptor:
------------------------------
0x0A	bLength
0x06	bDescriptorType
0x0200	bcdUSB
0x00	bDeviceClass      
0x00	bDeviceSubClass   
0x00	bDeviceProtocol   
0x40	bMaxPacketSize0   (64 bytes)
0x01	bNumConfigurations 
0x00	bReserved 

Configuration Descriptor:
------------------------------
0x09	bLength
0x02	bDescriptorType
0x0020	wTotalLength   (32 bytes)
0x01	bNumInterfaces
0x01	bConfigurationValue
0x00	iConfiguration
0x80	bmAttributes   (Bus-powered Device)
0xFA	bMaxPower      (500 mA)

Interface Descriptor:
------------------------------
0x09	bLength
0x04	bDescriptorType
0x00	bInterfaceNumber
0x00	bAlternateSetting
0x02	bNumEndPoints
0x08	bInterfaceClass      (Mass Storage Device Class)
0x06	bInterfaceSubClass   (Transparent SCSI subclass)
0x50	bInterfaceProtocol   (Bulk only transport)
0x00	iInterface

Endpoint Descriptor:
------------------------------
0x07	bLength
0x05	bDescriptorType
0x81	bEndpointAddress  (IN endpoint 1)
0x02	bmAttributes      (Transfer: Bulk / Synch: None / Usage: Data)
0x0200	wMaxPacketSize    (512 bytes)
0xFF	bInterval         

Endpoint Descriptor:
------------------------------
0x07	bLength
0x05	bDescriptorType
0x02	bEndpointAddress  (OUT endpoint 2)
0x02	bmAttributes      (Transfer: Bulk / Synch: None / Usage: Data)
0x0200	wMaxPacketSize    (512 bytes)
0xFF	bInterval         


------------------------------
Other Speed Configuration Descriptor:
------------------------------
0x09	bLength
0x07	bDescriptorType
0x0020	wTotalLength   (32 bytes)
0x01	bNumInterfaces
0x01	bConfigurationValue
0x00	iConfiguration
0x80	bmAttributes   (Bus-powered Device)
0xFA	bMaxPower      (500 mA)

Interface Descriptor:
------------------------------
0x09	bLength
0x04	bDescriptorType
0x00	bInterfaceNumber
0x00	bAlternateSetting
0x02	bNumEndPoints
0x08	bInterfaceClass      (Mass Storage Device Class)
0x06	bInterfaceSubClass   (Transparent SCSI subclass)
0x50	bInterfaceProtocol   (Bulk only transport)
0x00	iInterface

Endpoint Descriptor:
------------------------------
0x07	bLength
0x05	bDescriptorType
0x81	bEndpointAddress  (IN endpoint 1)
0x02	bmAttributes      (Transfer: Bulk / Synch: None / Usage: Data)
0x0040	wMaxPacketSize    (64 bytes)
0xFF	bInterval         

Endpoint Descriptor:
------------------------------
0x07	bLength
0x05	bDescriptorType
0x02	bEndpointAddress  (OUT endpoint 2)
0x02	bmAttributes      (Transfer: Bulk / Synch: None / Usage: Data)
0x0040	wMaxPacketSize    (64 bytes)
0xFF	bInterval         

Microsoft OS Descriptor is not available. Error code: 0x0000001F

String Descriptor Table
--------------------------------
Index  LANGID  String
0x00   0x0000  0x0409 
0x01   0x0409  "HP"
0x02   0x0409  "v165w"
0x03   0x0409  "AA00000000006894"

------------------------------

Connection path for device: 
Intel(R) 8 Series/C220 Series USB EHCI #2 - 8C2D
Root Hub
Generic USB Hub
v165w (VID=0x03F0 PID=0x5307) Port: 3

Running on: Windows 7 with Service Pack 1

Brought to you by TDD v2.12.0, Aug  2 2019, 16:35:05
